{"$schema":"https://json-schema.org/draft/2020-12/schema","$id":"https://aetherion.local/schemas/scenario-v1.json","type":"object","additionalProperties":false,"required":["schema","project","max_ticks","events","assertions","budgets"],"properties":{"schema":{"const":"aetherion.scenario/v1"},"project":{"type":"object"},"max_ticks":{"type":"integer","minimum":0,"maximum":1000000},"events":{"type":"array","maxItems":10000},"assertions":{"type":"array","maxItems":10000},"budgets":{"type":"object"}}}